{
  "gcps": [
    {
      "world": [97.1805877419104, 3.2578402429992224],
      "image": [578, 3779]
    },
    {
      "world": [95.75768658834603, 2.8399231303739043],
      "image": [349, 3855]
    },
    {
      "world": [98.6704303085887, 3.5887634152449692],
      "image": [834, 3724]
    },
    {
      "world": [96.13028951090241, 4.147110928854772],
      "image": [396, 3629]
    },
    {
      "world": [98.78380465867059, 1.7403690250373955],
      "image": [845, 4039]
    },
    {
      "world": [95.30603649176652, 5.780419948549238],
      "image": [252, 3345]
    },
    {
      "world": [97.48314719079927, 5.244320402045915],
      "image": [625, 3441]
    }
  ],
  "image": {
    "id": "d144156fc3c7f96c",
    "uri": "https://cdm21033.contentdm.oclc.org/digital/iiif/krt/1022",
    "type": "ImageService2",
    "width": 3493,
    "height": 4292
  },
  "version": 1,
  "pixelMask": [
    [196, 3324],
    [861, 3323],
    [856, 4061],
    [369, 4057],
    [370, 3925],
    [305, 3852],
    [191, 3851]
  ]
}
