{
  "id": "638c301276143e9a",
  "gcps": [
    {
      "world": [-71.0098934, 42.3384275],
      "image": [9944, 5819]
    },
    {
      "world": [-71.0298213, 42.3646445],
      "image": [4360, 253]
    },
    {
      "world": [-71.0399214, 42.3533058],
      "image": [3293, 3757]
    }
  ],
  "image": {
    "id": "2caaf62b5fe68a89",
    "uri": "https://iiif.digitalcommonwealth.org/iiif/2/commonwealth:pv63jj022",
    "type": "ImageService2",
    "width": 10844,
    "height": 9131
  },
  "version": 1,
  "pixelMask": [[143, 44]]
}
